{
  "protocol": "gahyeon.unreal.v1",
  "schemaVersion": 1,
  "messageId": "cognition-started-12",
  "type": "cognition.request.started",
  "sentAt": "2026-08-11T03:00:01Z",
  "sessionId": "desktop-local-user",
  "correlationId": "unreal:g12:client-message-1",
  "delivery": "durable",
  "sequence": 19,
  "payload": {
    "generation": 12,
    "source": "desktop",
    "modality": "voice",
    "actorId": "local-user"
  }
}
