{
  "protocol": "gahyeon.unreal.v1",
  "schemaVersion": 1,
  "messageId": "client-hello-1",
  "type": "client.hello",
  "sentAt": "2026-08-11T03:00:00Z",
  "sessionId": "desktop-local-user",
  "correlationId": "connection-1",
  "delivery": "ephemeral",
  "payload": {
    "sessionId": "desktop-local-user",
    "worldId": "gahyeon-home",
    "installationId": "unreal-installation-1",
    "displayName": "사용자",
    "lastSequence": 0
  }
}
