{
  "protocol": "gahyeon.unreal.v1",
  "schemaVersion": 1,
  "messageId": "event-action-desk-18-result",
  "type": "character.action.result",
  "sentAt": "2026-08-11T03:00:08Z",
  "sessionId": "desktop:local-user",
  "correlationId": "world-action-result:action-desk-18",
  "delivery": "durable",
  "sequence": 19,
  "payload": {
    "actionId": "action-desk-18",
    "expectedRevision": 17,
    "outcome": "completed",
    "result": "committed",
    "finalPosition": {"x": 7.0, "y": 0.0, "z": -2.0},
    "reason": "core_headless_execution"
  }
}
