{
  "protocol": "gahyeon.unreal.v1",
  "schemaVersion": 1,
  "messageId": "ack-action-desk-18",
  "type": "character.action.acknowledged",
  "sentAt": "2026-08-11T03:00:08Z",
  "sessionId": "desktop:local-user",
  "correlationId": "world-action:action-desk-18",
  "delivery": "ephemeral",
  "payload": {
    "actionId": "action-desk-18",
    "result": "committed",
    "terminal": true,
    "accepted": true,
    "duplicate": false
  }
}
