{
  "protocol": "gahyeon.unreal.v1",
  "schemaVersion": 1,
  "messageId": "state-target-1843",
  "type": "character.state.target",
  "sentAt": "2026-08-11T03:00:00.100Z",
  "sessionId": "desktop-local-user",
  "correlationId": "conversation-42",
  "delivery": "durable",
  "sequence": 1843,
  "payload": {
    "generation": 13,
    "state": "thinking",
    "priority": 60,
    "expiresAfterMs": 1500
  }
}
