{
  "protocol": "gahyeon.unreal.v1",
  "schemaVersion": 1,
  "messageId": "attention-301",
  "type": "attention.target",
  "sentAt": "2026-08-11T03:00:01.080Z",
  "sessionId": "desktop-local-user",
  "correlationId": "conversation-43",
  "delivery": "ephemeral",
  "payload": {
    "kind": "user",
    "targetId": "local-user",
    "priority": 100,
    "expiresAfterMs": 500,
    "headWeight": 0.65,
    "eyeWeight": 1.0
  }
}
