{
  "protocol": "gahyeon.unreal.v1",
  "schemaVersion": 1,
  "messageId": "speech-sequence-ended-1",
  "type": "speech.sequence.ended",
  "sentAt": "2026-08-11T03:00:03Z",
  "sessionId": "desktop-local-user",
  "correlationId": "unreal:g12:client-message-1",
  "delivery": "ephemeral",
  "payload": {
    "generation": 12,
    "utteranceCount": 2,
    "outcome": "completed"
  }
}
