{
  "protocol": "gahyeon.unreal.v1",
  "schemaVersion": 1,
  "messageId": "event-1842",
  "type": "emotion.target",
  "sentAt": "2026-08-11T03:00:00Z",
  "correlationId": "conversation-42",
  "delivery": "durable",
  "sequence": 1842,
  "payload": {
    "revision": 7,
    "dimensions": {
      "curiosity": 0.7
    },
    "blendSeconds": 0.25
  }
}
